{
  "site": "anime",
  "account": "otakuquiz_team",
  "group_slug": "that-time-i-got-reincarnated-as-a-slime",
  "title": "Reincarnated as a Slime Hard Quiz: Demon Lords, Megiddo and the True Hero",
  "slug": "demon-lords-megiddo-and-the-true-hero-reincarnated-as-a-slime-hard-quiz",
  "description": "Ten hard questions on the later seasons: the knight who attacks Rimuru, the fall of a great army, the Demon Lords, the Labyrinth and the secret of a hero. Spoilers up to the fourth season.",
  "quiz_type": "multiple_choice",
  "difficulty": "hard",
  "language": "en",
  "title_gives_nothing_away": true,
  "notes": "Hard quiz: late facts (arcs 2 to 6) only here. Spoilers named in the description.",
  "questions": [
    {
      "question": "On the road back from Ingracia, which holy knight attacks Rimuru in revenge for Shizu?",
      "options": [
        "Luminous Twilight Valentine",
        "Hinata Sakaguchi",
        "Milim Nava",
        "Clayman"
      ],
      "correct": 1,
      "kind": "character",
      "spoiler": {
        "arc": 3,
        "scope": "both"
      },
      "fact_ids": [
        "that-time-i-got-reincarnated-as-a-slime-hinata-ambush-078"
      ],
      "source_url": "https://en.wikipedia.org/wiki/That_Time_I_Got_Reincarnated_as_a_Slime_(TV_series)"
    },
    {
      "question": "How many soldiers does Rimuru wipe out with the spell Megiddo?",
      "options": [
        "5,000",
        "10,000",
        "20,000",
        "50,000"
      ],
      "correct": 2,
      "kind": "ability",
      "spoiler": {
        "arc": 3,
        "scope": "both"
      },
      "fact_ids": [
        "that-time-i-got-reincarnated-as-a-slime-megiddo-031"
      ],
      "source_url": "https://en.wikipedia.org/wiki/That_Time_I_Got_Reincarnated_as_a_Slime_(TV_series)"
    },
    {
      "question": "Which Primordial Demon, known as Noir, does Rimuru summon as his servant?",
      "options": [
        "Diablo",
        "Clayman",
        "Gobta",
        "Souei"
      ],
      "correct": 0,
      "kind": "character",
      "spoiler": {
        "arc": 3,
        "scope": "both"
      },
      "fact_ids": [
        "that-time-i-got-reincarnated-as-a-slime-diablo-noir-079"
      ],
      "source_url": "https://en.wikipedia.org/wiki/That_Time_I_Got_Reincarnated_as_a_Slime_(TV_series)"
    },
    {
      "question": "Into what are the Ten Great Demon Lords restructured?",
      "options": [
        "The Pentagram",
        "The Octagram",
        "The Hexagram",
        "The Heptagram"
      ],
      "correct": 1,
      "kind": "lore",
      "spoiler": {
        "arc": 3,
        "scope": "both"
      },
      "fact_ids": [
        "that-time-i-got-reincarnated-as-a-slime-octagram-032"
      ],
      "source_url": "https://en.wikipedia.org/wiki/That_Time_I_Got_Reincarnated_as_a_Slime_(TV_series)"
    },
    {
      "question": "Which nickname does the Demon Lord Clayman carry?",
      "options": [
        "Labyrinth Master",
        "Destroyer",
        "Marionette Master",
        "Queen of Nightmares"
      ],
      "correct": 2,
      "kind": "character",
      "spoiler": {
        "arc": 3,
        "scope": "both"
      },
      "fact_ids": [
        "that-time-i-got-reincarnated-as-a-slime-clayman-marionette-080",
        "that-time-i-got-reincarnated-as-a-slime-milim-destroyer-074",
        "that-time-i-got-reincarnated-as-a-slime-ramiris-labyrinth-076"
      ],
      "source_url": "https://en.wikipedia.org/wiki/List_of_That_Time_I_Got_Reincarnated_as_a_Slime_characters"
    },
    {
      "question": "Who secretly rules the Western Holy Empire while posing as a maid?",
      "options": [
        "Hinata Sakaguchi",
        "Clayman",
        "Luminous Twilight Valentine",
        "Ramiris"
      ],
      "correct": 2,
      "kind": "character",
      "spoiler": {
        "arc": 3,
        "scope": "both"
      },
      "fact_ids": [
        "that-time-i-got-reincarnated-as-a-slime-luminous-queen-081"
      ],
      "source_url": "https://en.wikipedia.org/wiki/List_of_That_Time_I_Got_Reincarnated_as_a_Slime_characters"
    },
    {
      "question": "How many floors does the Labyrinth open by Rimuru have?",
      "options": [
        "50",
        "80",
        "200",
        "100"
      ],
      "correct": 3,
      "kind": "lore",
      "spoiler": {
        "arc": 4,
        "scope": "both"
      },
      "fact_ids": [
        "that-time-i-got-reincarnated-as-a-slime-labyrinth-033"
      ],
      "source_url": "https://en.wikipedia.org/wiki/That_Time_I_Got_Reincarnated_as_a_Slime_(TV_series)"
    },
    {
      "question": "Which Chosen Hero does Rimuru befriend when the Labyrinth opens?",
      "options": [
        "Hinata Sakaguchi",
        "Luminous Twilight Valentine",
        "Masayuki Rudra Nam Ul Nasca",
        "Shizue Izawa"
      ],
      "correct": 2,
      "kind": "character",
      "spoiler": {
        "arc": 4,
        "scope": "both"
      },
      "fact_ids": [
        "that-time-i-got-reincarnated-as-a-slime-masayuki-hero-082"
      ],
      "source_url": "https://en.wikipedia.org/wiki/That_Time_I_Got_Reincarnated_as_a_Slime_(TV_series)"
    },
    {
      "question": "Who betrays and kills Maribel, then blames the Demon Lords?",
      "options": [
        "Hinata Sakaguchi",
        "Clayman",
        "Diablo",
        "Yuuki Kagurazaka"
      ],
      "correct": 3,
      "kind": "character",
      "spoiler": {
        "arc": 5,
        "scope": "both"
      },
      "fact_ids": [
        "that-time-i-got-reincarnated-as-a-slime-yuuki-maribel-035"
      ],
      "source_url": "https://en.wikipedia.org/wiki/That_Time_I_Got_Reincarnated_as_a_Slime_(TV_series)"
    },
    {
      "question": "What is the True Hero Chronoa revealed to be?",
      "options": [
        "A clone of Hinata made by Yuuki",
        "The personification of Chloe's grief and rage",
        "A spirit sealed in the castle",
        "An earlier form of Rimuru"
      ],
      "correct": 1,
      "kind": "character",
      "spoiler": {
        "arc": 6,
        "scope": "both"
      },
      "fact_ids": [
        "that-time-i-got-reincarnated-as-a-slime-chronoa-036"
      ],
      "source_url": "https://en.wikipedia.org/wiki/That_Time_I_Got_Reincarnated_as_a_Slime_(TV_series)"
    }
  ],
  "sources": [
    {
      "id": "S1",
      "title": "Wikipedia: That Time I Got Reincarnated as a Slime (TV series)",
      "url": "https://en.wikipedia.org/wiki/That_Time_I_Got_Reincarnated_as_a_Slime_(TV_series)"
    },
    {
      "id": "S2",
      "title": "Wikipedia: List of That Time I Got Reincarnated as a Slime characters",
      "url": "https://en.wikipedia.org/wiki/List_of_That_Time_I_Got_Reincarnated_as_a_Slime_characters"
    }
  ]
}
